cat_no,context,figure_num,gender,qualifier,descriptor_text,descriptor_length,word_count
P000768,secular,3,Female,,"The woman is lying down on a blanket, leaning back with her legs up, and appears to be enjoying herself. She is looking towards the man with a playful expression. Her posture suggests she is active and engaging.",211,38
P000768,secular,4,Female,,The woman is standing and appears to be serving food from a basket. She is looking towards the man with a friendly expression. Her posture suggests she is dominant and nurturing.,178,31
P000768,secular,5,Male,,"The man is sitting upright, leaning forward slightly, and appears attentive. He is looking towards the woman with a curious expression. His posture suggests he is active and engaged.",182,29
P000768,secular,6,Female,,"The woman is sitting on the ground, leaning back with her legs up, and appears relaxed. She is looking towards the man with a content expression. Her posture suggests she is passive and submissive.",197,34
P000768,secular,7,Male,,"The man is sitting upright, leaning forward slightly, and appears attentive. He is looking towards the woman with a curious expression. His posture suggests he is active and engaged.",182,29
P000768,secular,8,Female,,The woman is standing and appears to be serving food from a basket. She is looking towards the man with a friendly expression. Her posture suggests she is dominant and nurturing.,178,31
P000768,secular,9,Male,,"The man is sitting upright, leaning back slightly, and appears relaxed. He is looking towards the woman with a content expression. His posture suggests he is passive and submissive.",181,29
P000768,secular,10,Female,,The woman is standing and appears to be serving food from a basket. She is looking towards the man with a friendly expression. Her posture suggests she is dominant and nurturing.,178,31
P000768,secular,11,Male,,"The man is sitting upright, leaning forward slightly, and appears attentive. He is looking towards the woman with a curious expression. His posture suggests he is active and engaged.",182,29
P000768,secular,12,Female,,The woman is standing and appears to be serving food from a basket. She is looking towards the man with a friendly expression. Her posture suggests she is dominant and nurturing.,178,31
P002918,secular,1,Male,,"The main figure is seated on an ornate chair with one hand resting on the armrest and the other holding a sword. The figure's posture is upright and confident, suggesting dominance and authority. The gaze is directed slightly to the left, giving a sense of contemplation or focus. The facial expression appears calm and composed, with a slight smile that conveys confidence and ease. The overall impression is one of authority and control.",439,73
P002303,secular,1,Female,,"The woman stands with her hands clasped together, gazing towards the right side of the painting. Her posture is upright and composed, suggesting a sense of calmness and perhaps contemplation. She appears passive and somewhat submissive.",236,36
P002303,secular,2,Male,,"The man sits on the ground, leaning slightly forward with his legs crossed. He holds a stick or staff in his left hand, which rests on the ground. His gaze is directed towards the woman, and he appears to be in a relaxed but attentive stance. He seems to be in a supportive role, possibly indicating a nurturing or subordinate position.",336,61
P002303,secular,3,Female,,"The seated woman is positioned near the center of the painting, leaning back slightly with her arms resting on her knees. Her gaze is directed towards the man, and she appears to be in a relaxed state, possibly engaged in conversation or observation. She seems passive and somewhat submissive.",293,49
P002303,secular,4,Male,,"The standing man is positioned to the left of the painting, facing the seated woman. He has one arm resting on his hip and the other holding a stick or staff. His posture suggests confidence and authority, and he appears to be the dominant figure in the scene.",260,48
P002303,secular,5,Female,,"The woman on the far right is sitting on a rock by the water's edge. She is looking towards the man who is standing nearby. Her posture is relaxed, and she appears passive and somewhat submissive.",196,36
P002303,secular,6,Male,,"The man on the far right is standing near the water's edge, facing the seated woman. He appears to be in a relaxed stance, with one hand resting on his hip and the other holding a stick or staff. His gaze is directed towards the seated woman, and he seems to be in a supportive role.",283,56
P002303,secular,7,Female,,"The woman on the far left is standing with her hands clasped together, looking towards the right side of the painting. Her posture is upright and composed, suggesting a sense of calmness and perhaps contemplation. She appears passive and somewhat submissive.",258,41
P002303,secular,8,Male,,"The man on the far left is standing with his hands behind his back, looking towards the seated woman. His posture is upright and confident, suggesting a sense of authority. He appears to be the dominant figure in the scene.",223,40
P002862,secular,1,Female,,"The main figure is seated with one arm extended outward, holding what appears to be a small object or piece of fabric. The other arm rests gently on her lap. Her gaze is directed slightly to the side, not directly at the viewer, giving a sense of contemplation or reserve. She wears an elaborate dress with a voluminous skirt adorned with gold dots and a lace-trimmed bodice. Her posture suggests a sense of calm authority rather than dominance or passivity. The overall impression is one of quiet dignity and composure.",520,90
P002349,secular,1,Male,,"The boy is crouched low to the ground, leaning forward with his arms extended upwards towards the kite. His gaze is directed upwards, focused intently on the kite flying high in the sky. His facial expression appears determined and slightly strained, suggesting effort and concentration. He seems active and dominant in his engagement with the kite.",349,56
P002349,secular,2,Male,,"The man standing behind the boy has his hands raised, appearing to assist or guide the boy as he flies the kite. His gaze is also directed upwards, following the kite's flight path. His posture suggests he is actively involved in the activity but not as physically engaged as the boy. He appears supportive and nurturing.",321,56
P002349,secular,3,Female,,"The woman standing near the man has her hands clasped together and her gaze directed downwards, possibly observing something on the ground. Her posture is relaxed and passive compared to the other figures. She does not seem to be directly participating in the kite-flying activity.",281,45
P002349,secular,4,Male,,"The man in the red outfit is standing upright, facing the boy who is flying the kite. His hands are positioned as if he is about to assist or guide the boy. His gaze is directed towards the boy, indicating a supportive role. His posture suggests he is actively involved but not as physically engaged as the boy.",311,58
P002349,secular,5,Male,,"The man in the blue outfit is standing further back, observing the scene. His hands are at his sides, and his gaze is directed towards the boy and the kite. His posture is relaxed and passive, suggesting he is a bystander rather than an active participant.",256,46
P002349,secular,6,Male,,"The man in the brown outfit is standing close to the woman, also observing the scene. His hands are at his sides, and his gaze is directed towards the boy and the kite. His posture is relaxed and passive, similar to the woman's, indicating he is a bystander.

All figures appear to be engaged in the activity of kite-flying, with varying levels of involvement and roles within the scene.",387,69
P007742,secular,1,Male,,"The individual is depicted from the shoulders up, wearing a light-colored coat with a dark cravat. The head is slightly tilted to the right, and the gaze is directed straight ahead, giving an impression of direct engagement with the viewer. The facial expression appears calm and composed, with a hint of seriousness. The posture suggests a sense of authority and dominance.",374,61
P003116,secular,1,Female,,"The woman is seated with her body slightly turned to the left, creating a sense of engagement with the viewer. Her gaze is directed straight ahead, conveying a composed and confident demeanor. The softness of her facial features and the gentle curve of her lips suggest a calm and serene expression. She appears dominant and authoritative, as indicated by the way she holds herself and the directness of her gaze.",413,70
P008360,secular,1,Male,,"The dog is positioned in the foreground, actively running towards the right side of the painting. Its body is low to the ground, with its tail slightly raised, indicating movement and alertness. The dog's gaze is directed forward, showing focus and determination. It appears dominant and active.",295,47
P008360,secular,2,Male,,"This dog is lying down in the background, partially obscured by foliage. Its body is relaxed, and it seems to be resting or observing the scene. The dog's gaze is directed towards the left side of the painting, suggesting a passive and observant demeanor. It appears submissive and passive.",290,49
P006219,secular,1,Male,,"The shepherd stands with his back slightly turned to the viewer, holding a staff in one hand. His posture is relaxed yet attentive, suggesting he is overseeing the flock. His gaze is directed towards the sheep, indicating a nurturing and authoritative stance. He appears dominant and active.",291,47
P006219,secular,2,Male,,"A second shepherd is seen in the distance, walking away from the viewer. His posture is upright, and his gaze is directed forward, suggesting he is focused on his task. He appears passive and less dominant compared to the first shepherd.",237,41
P006219,secular,3,Female,,"A woman is seated near the left side of the painting, tending to the sheep. Her posture is relaxed, and she appears to be engaged in a nurturing activity, possibly milking a sheep. She has a calm and content facial expression, indicating a passive and nurturing role.",267,47
