cat_no,context,figure_num,gender,qualifier,descriptor_text,descriptor_length,word_count
P005481,religious,1,Male,,"The central figure is kneeling with his hands clasped together in prayer. His head is bowed, and his eyes are closed, suggesting deep contemplation or submission. He appears passive and submissive.",197,31
P005481,religious,2,Male,,"This figure stands to the left of the central figure, holding a staff or cross. His posture is upright, and he looks down at the central figure, indicating a position of authority or dominance. His expression is serious and commanding.",235,40
P005481,religious,3,Male,,"This figure is positioned behind the central figure, slightly to the right. He is also kneeling and appears to be in a state of prayer or meditation. His gaze is directed towards the central figure, suggesting a supportive role rather than one of dominance.",257,44
P005481,religious,4,Male,,"This figure is standing to the right of the central figure, holding a book open. His posture is upright, and he seems to be reading or studying from the book. His expression is focused and attentive, indicating an active and engaged role.",238,42
P005481,religious,5,Male,,"This figure is standing further back, near the center-right of the painting. He is holding a staff or cross and appears to be in a position of leadership or guidance. His gaze is directed towards the central figure, suggesting a role of authority or mentorship.",261,45
P005481,religious,6,Male,,"This figure is standing to the far right, partially obscured by shadows. He is holding a staff or cross and appears to be in a position of authority or leadership. His gaze is directed towards the central figure, indicating a role of guidance or oversight.",256,45
P005481,religious,7,Male,,"This figure is standing to the far left, partially obscured by shadows. He is holding a staff or cross and appears to be in a position of authority or leadership. His gaze is directed towards the central figure, indicating a role of guidance or oversight.",255,45
P005481,religious,8,Male,,"This figure is standing to the far right, partially obscured by shadows. He is holding a staff or cross and appears to be in a position of authority or leadership. His gaze is directed towards the central figure, indicating a role of guidance or oversight.",256,45
P005481,religious,9,Male,,"This figure is standing to the far left, partially obscured by shadows. He is holding a staff or cross and appears to be in a position of authority or leadership. His gaze is directed towards the central figure, indicating a role of guidance or oversight.",255,45
P005481,religious,10,Male,,"This figure is standing to the far right, partially obscured by shadows. He is holding a",88,16
P001240,religious,1,Female,,"The figure lies on her side, draped partially by a rich, dark red fabric that covers much of her body. Her head rests on a wooden block, and her arm is extended outward, resting on another block. Her gaze is directed downward, and her facial expression appears serene yet somber. She seems passive and vulnerable, with no indication of dominance or authority. The overall posture suggests a state of rest or perhaps even sleep.",427,74
P003507,religious,1,Male,,"The man is standing with his hands outstretched, gesturing towards the group of people. His posture is open and engaging, suggesting he is speaking or explaining something. His facial expression appears calm and composed, indicating he is in control of the situation. He seems to be dominant and authoritative, actively engaging with the others.",345,54
P003507,religious,2,Female,,"The woman is kneeling, leaning forward slightly, with her hands clasped together. Her gaze is directed upwards towards the man, showing a sense of reverence or submission. Her facial expression is one of quiet contemplation or perhaps slight fear. She appears submissive and passive, focused on the man's words or actions.",322,51
P003507,religious,3,Female,,"The woman is sitting on the ground, leaning back against another person. She has a distressed or pained expression, with her mouth slightly open as if she is crying or gasping for air. Her posture suggests she is in distress or discomfort, and she appears passive and vulnerable.",279,48
P003507,religious,4,Female,,"The woman is kneeling, leaning forward with her hands resting on her lap. Her gaze is directed towards the man, and her facial expression is one of concern or worry. She appears to be listening intently and is likely feeling submissive or subordinate in this interaction.",271,46
P003507,religious,5,Female,,"The woman is kneeling, leaning forward with her hands clasped together. Her gaze is directed towards the man, and her facial expression is one of concern or worry. She appears to be listening intently and is likely feeling submissive or subordinate in this interaction.",269,44
P003507,religious,6,Male,,"The man is standing, leaning slightly forward with his hands resting on his knees. His gaze is directed towards the group, and his facial expression is one of concern or worry. He appears to be listening intently and is likely feeling submissive or subordinate in this interaction.",281,47
P003507,religious,7,Male,,"The man is standing, leaning slightly forward with his hands resting on his knees. His gaze is directed towards the group, and his facial expression is one of concern or worry. He appears to be listening intently and is likely feeling submissive or subordinate in this interaction.",281,47
P003507,religious,8,Male,,"The man is standing, leaning slightly forward with his hands resting on his knees. His gaze is directed towards the group, and his facial expression is one of concern or worry. He appears to be listening intently and is likely feeling submissive or subordinate in this interaction.",281,47
P002917,religious,1,Female,,"The woman is seated with her body slightly turned towards the man, her gaze directed at him with a calm and composed expression. Her posture suggests she is engaged in conversation but not overly assertive. She appears to be passive and receptive.",247,42
P002917,religious,2,Male,,"The man stands with his body angled towards the woman, his gaze fixed on her with an attentive and possibly curious expression. His posture indicates he is actively involved in the interaction, suggesting he may be dominant or authoritative in this scene.",255,42
P000129,religious,1,Male,,"The central figure is shirtless, with his right arm bent at the elbow and his hand resting on his hip. His gaze is directed downward, and his facial expression appears contemplative and somewhat pensive. He seems to be in a passive state, possibly reflecting or enduring a moment of introspection.",297,50
P000129,religious,2,Male,,"The second male figure is partially obscured by the central figure but appears to be supporting him from behind. His gaze is directed toward the central figure, and his facial expression suggests concern or attentiveness. This figure appears to be dominant and nurturing, providing support to the central figure.",312,49
P000129,religious,3,Male,,"The third male figure is positioned to the left side of the painting. His head is slightly tilted, and he looks downward with a thoughtful expression. His posture is relaxed, and he does not seem to be actively engaging with the central figure. This figure appears passive and reflective.",288,49
P000082,religious,1,Male,,"The male figure is reclining on a rock, his body partially draped with a flowing cloth that covers his lower torso. His head rests on one hand, while the other hand holds a small object, possibly a piece of paper or a scroll. He gazes off to the side with a contemplative and somewhat melancholic expression. The figure appears passive and reflective, suggesting a moment of introspection or rest.",397,69
P002643,religious,1,Female,,"The woman is seated with her legs crossed, holding the baby close to her chest. Her gaze is directed downward, and her facial expression appears serene and gentle. She appears nurturing and dominant over the child, as she holds him securely.",241,41
P002643,religious,2,Male,,"The baby is held close to the woman's chest, looking down at his feet. His posture is relaxed, and he appears passive and dependent on the woman for care.",154,29
P003122,religious,1,Male,,"The male figure is seated with his head bowed slightly downward, his hands resting on his knees. His gaze is directed downward, and his facial expression appears contemplative and serene. He seems to be in a state of deep thought or prayer, suggesting a submissive and passive demeanor.",286,48
P003122,religious,2,Female,,"The female figure, an angel, is positioned behind the male figure. She has her wings spread wide, and her gaze is directed downward towards the male figure. Her facial expression is gentle and nurturing, with a slight smile. The angel's posture suggests she is dominant yet protective, providing a sense of comfort and guidance to the male figure.",347,58
P001093,religious,1,Male,,"The figure is depicted in profile, facing to the right. They are wearing a loose, flowing robe that drapes over their shoulders and chest. The individual's head is slightly tilted downward, and their gaze is directed downwards towards their hand, which holds a small object. Their facial expression appears contemplative and focused, with a hint of seriousness. The posture suggests a sense of introspection or concentration, and the overall impression is one of quiet authority and dominance.",493,77
P003345,religious,1,Male,,"The man is kneeling with his head bowed, hands clasped together in prayer. His gaze is directed downward, and his facial expression appears serene and contemplative. He appears submissive and passive.",200,31
P003345,religious,2,Female,,"The woman stands beside the kneeling man, her hand gently placed on his shoulder. She is barefoot, wearing a flowing yellow dress with a blue undergarment. Her gaze is directed towards the man, and her facial expression is calm and gentle. She appears nurturing and authoritative.",280,46
P003345,religious,3,Male,,"The man is standing upright, leaning slightly forward with one hand resting on the shoulder of the kneeling man. His gaze is directed towards the kneeling man, and his facial expression is serious and focused. He appears dominant and active.",241,40
P003345,religious,4,Female,,"The angel is depicted with wings spread wide, hovering above the scene. The angel's gaze is directed towards the kneeling man, and her facial expression is serene and benevolent. She appears nurturing and authoritative.",219,34
P003345,religious,5,Male,,"The man is seated on the ground, with his hands raised in a gesture of prayer or supplication. His gaze is directed upwards, and his facial expression is one of reverence and devotion. He appears submissive and passive.",219,38
P003345,religious,6,Male,,"The man is seated on the ground, with his hands resting on his knees. His gaze is directed downwards, and his facial expression is one of contemplation and peace. He appears passive and reflective.",197,34
P003345,religious,7,Male,,"The man is seated on the ground, with his hands resting on his knees. His gaze is directed downwards, and his facial expression is one of contemplation and peace. He appears passive and reflective.",197,34
P005701,religious,1,Female,,"The woman is seated in a chair with her hands raised in a gesture of greeting or blessing. She looks directly at the child, her expression gentle and serene, suggesting a nurturing and authoritative presence.",208,35
P005701,religious,2,Female,,"The woman stands to the left, facing away from the central scene. Her posture is upright, and she appears to be observing the interaction between the seated woman and the child. Her expression is neutral, and she seems passive in this moment.",242,42
P005701,religious,3,Female,,"The woman is kneeling before the seated woman, holding the child's hand. She is dressed in a vibrant yellow gown and has a red and white striped sleeve. Her gaze is directed towards the child, and her posture suggests she is actively engaged in the interaction, possibly offering support or comfort.",299,51
P005701,religious,4,Male,,"The man stands to the right of the seated woman, raising his hand as if to speak or gesture. He wears a dark outfit with a high collar and appears to be addressing the group, indicating an active role in the scene.",214,42
P005701,religious,5,Male,,"The man is partially obscured by the woman in the green dress but appears to be standing close to her. His posture is relaxed, and he seems to be listening or observing the interaction.",185,34
P005701,religious,6,Female,,"The woman in the green dress stands near the man in the dark outfit. She raises her hand, possibly in a gesture of greeting or acknowledgment. Her expression is calm, and she appears to be part of the group's interaction.",221,40
P005701,religious,7,Female,,"The woman in the brown robe stands to the far right, facing the seated woman. Her posture is upright, and she appears to be observing the scene with a neutral expression.",170,31
P000830,religious,1,Male,,"The central male figure is seated, leaning slightly forward with his hands clasped together. His gaze is directed downward, and his facial expression appears contemplative and serene. He exudes an aura of authority and dominance.",229,35
P000830,religious,2,Female,,"The female figure, dressed in gold, is kneeling before the central male figure. Her posture is one of reverence and submission, with her head bowed and hands resting on the ground. Her gaze is directed upward, and her expression is one of devotion and humility.",261,45
P000830,religious,3,Male,,"The male figure to the right of the central figure is standing with his back turned to the viewer. He wears a white robe and appears to be in a position of leadership or authority, as he faces the central figure.",212,41
P000830,religious,4,Male,,The male figure to the left of the central figure is also standing with his back turned to the viewer. He is wearing dark robes and appears to be observing the scene with a serious expression.,192,36
P000830,religious,5,Male,,"The male figure in the foreground, to the left of the central figure, is standing with his hands clasped behind his back. He is wearing dark robes and appears to be in a position of authority, as he looks towards the central figure.",232,43
P000830,religious,6,Male,,"The male figure in the background, to the right of the central figure, is standing with his hands clasped in front of him. He is wearing dark robes and appears to be observing the scene with a serious expression.",212,39
P000830,religious,7,Male,,"The male figure in the background, to the left of the central figure, is standing with his hands clasped in front of him. He is wearing dark robes and appears to be observing the scene with a serious expression.",211,39
P000830,religious,8,Male,,"The male figure in the background, to the right of the central figure, is standing with his hands clasped in front of him. He is wearing dark robes and appears to be observing the scene with a serious expression.",212,39
P000830,religious,9,Male,,"The male figure in the background, to the left of the central figure, is standing with his hands clasped in front of him. He is wearing dark robes and appears to be observing the scene with a serious expression.",211,39
P000830,religious,10,Male,,"The male figure in the background, to the right of the central figure, is standing with his hands clasped in front of him. He is wearing dark robes and appears to be observing the scene with a serious expression.",212,39
P000536,religious,1,Female,,"The woman is seated with her body slightly leaning forward, cradling two infants in her lap. Her gaze is directed downward towards the infants, and her facial expression appears serene and gentle. She appears nurturing and passive, as she is focused on the care of the infants.",277,47
P000536,religious,2,Male,Infant,"The first infant is lying on its back, partially covered by a white cloth. The infant's gaze is directed towards the woman, and it appears calm and peaceful.",157,28
P000536,religious,3,Male,Infant,"The second infant is also lying on its back, partially covered by a white cloth. This infant is positioned closer to the woman's chest and appears to be nursing. Its gaze is directed towards the woman, and it looks content and secure.",234,42
P008153,religious,1,Male,,"The male figure stands with one leg slightly bent and the other extended, holding a flagpole with a white flag that has red stripes. His gaze is directed upwards towards the female figure, and his facial expression appears serene and contemplative. He appears dominant and authoritative, as he is positioned higher and more prominently in the composition.",355,57
P008153,religious,2,Female,,"The female figure is kneeling with her hands raised in a gesture of prayer or reverence. Her gaze is directed upwards towards the male figure, and her facial expression is one of devotion and humility. She appears submissive and passive, as she is kneeling and looking up at the male figure.",291,51
P007875,religious,1,Female,,"The central female figure is seated on a cloud, her body slightly turned to the left, with her hands clasped together in prayer. Her gaze is directed upwards towards the heavens, where a radiant light emanates from a figure above. She appears serene and reverent, exuding a sense of peace and authority.",303,52
P007875,religious,2,Male,,"The male figure on the right side of the painting stands with his hands clasped together, his gaze directed towards the central female figure. He wears a long robe and appears to be in a state of contemplation or reverence, suggesting a position of respect and submission.",272,47
P007875,religious,3,Male,,"The male figure on the far left is kneeling, his hands resting on a book or scroll. His gaze is directed towards the central female figure, indicating a posture of devotion and submission.",188,33
P007875,religious,4,Male,,"The male figure in the center-right is standing with one hand raised, as if gesturing or speaking. His gaze is directed towards the central female figure, suggesting an active role in the scene, possibly as a leader or speaker.",227,39
P007875,religious,5,Male,,"The male figure on the far right is standing with his hands clasped together, his gaze directed towards the central female figure. He appears to be in a state of reverence and submission.",187,33
P007875,religious,6,Male,,"The male figure in the center-left is standing with his hands resting on a book or scroll. His gaze is directed towards the central female figure, indicating a posture of devotion and submission.",195,33
P007875,religious,7,Male,,"The male figure in the center is standing with his hands clasped together, his gaze directed towards the central female figure. He appears to be in a state of reverence and submission.",184,32
P007875,religious,8,Male,,"The male figure on the far left is kneeling, his hands resting on a book or scroll. His gaze is directed towards the central female figure, indicating a posture of devotion and submission.",188,33
P007875,religious,9,Male,,"The male figure in the center is standing with his hands clasped together, his gaze directed towards the central female figure. He appears to be in a state of reverence and submission.",184,32
P007875,religious,10,Male,,"The male figure on the far right is standing with his hands clasped together, his gaze directed towards the central female figure. He appears to be in a state of reverence and submission.",187,33
P007875,religious,11,Male,,"The male figure in the center is standing with his hands clasped together, his gaze directed towards the central female figure. He",130,22
P003409,secular,1,Male,,"The main figure is depicted standing with arms crossed, holding a sword in one hand. The gaze is directed slightly to the left of the viewer, giving an impression of confidence and authority. The facial expression appears serious and composed, suggesting dominance and a sense of purpose. The posture and attire convey a sense of authority and readiness for action.",365,60
P002276,secular,1,Female,,"The woman is seated with her left arm resting on a red draped fabric, while her right hand is placed gently on her lap. She gazes directly at the viewer with a composed and serene facial expression. Her posture suggests a sense of calm authority and confidence. The way she holds herself indicates dominance and a nurturing presence.",333,58
P005823,secular,1,Female,,"The female figure is depicted in mid-flight, her left arm extended upwards with a hand gesture that suggests she is guiding or leading. Her right arm is bent at the elbow, holding the hand of a child. She wears a flowing, orange dress with a green sash that trails behind her. Her gaze is directed towards the child, and her facial expression appears serene and gentle. She exudes a sense of dominance and nurturing, actively guiding the child through the air.",460,81
P005823,secular,2,Male,Child,"The child is depicted as a small, nude figure with a light complexion. The child's arms are outstretched, mirroring the pose of the adult figure. The child's gaze is directed towards the adult, appearing trusting and dependent. The child's posture suggests a sense of innocence and vulnerability, making them appear passive and submissive within the scene.",356,56
P000401,secular,1,Male,,"The figure is seated with one hand resting on the armrest of a chair, while the other hand is placed on their lap. They are looking directly at the viewer with a calm and composed facial expression. The posture suggests a sense of authority and dominance, as the figure appears confident and in control.",303,54
P004802,secular,1,Male,,"The central male figure is mounted on a horse, leaning slightly forward with a determined expression. His gaze is directed towards the right side of the painting, suggesting he is focused on something beyond the scene. He appears dominant and authoritative, commanding attention as the focal point of the composition.",317,50
P004802,secular,2,Male,,"This male figure is also mounted on a horse, positioned to the left of the central figure. He is slightly turned towards the central figure, indicating engagement in the activity. His posture is upright, and his expression seems attentive and alert. He appears active and engaged in the scene.",293,49
P004802,secular,3,Female,,"A female figure is seated on a horse to the right of the central figure. She is looking towards the central figure with a calm and composed expression. Her posture is relaxed yet attentive, suggesting she is part of the group but not leading. She appears passive and supportive.",278,49
P004802,secular,4,Male,,"Another male figure is seen in the foreground, slightly to the left of the central figure. He is mounted on a horse and appears to be in motion, possibly chasing or pursuing something. His posture is dynamic, with one arm extended forward, indicating action. His expression is focused and intense, suggesting he is actively involved in the scene.",346,58
P004802,secular,5,Male,,"A male figure is seen further back in the scene, near the center. He is mounted on a horse and appears to be observing the activity around him. His posture is relaxed, and his gaze is directed towards the central figure, suggesting he is part of the group but not actively participating in the main action. He appears passive and observant.",340,61
P004802,secular,6,Male,,"This male figure is positioned further back in the scene, near the center-right. He is mounted on a horse and appears to be looking towards the central figure. His posture is upright, and his expression is calm and composed. He appears passive and supportive.",259,44
P004802,secular,7,Male,,"A male figure is seen further back in the scene, near the center-left. He is mounted on a horse and appears to be looking towards the central figure. His posture is upright, and his expression is calm and composed. He appears passive and supportive.",249,44
P004802,secular,8,Male,,"This male figure is positioned further back in the scene, near the center-right. He is mounted on a horse and appears to be looking towards the central figure. His posture is upright, and his expression is calm and composed. He appears passive and supportive.",259,44
P004802,secular,9,Male,,A male figure,13,3
P004472,secular,1,Female,,"The female figure is depicted in mid-flight, her arms outstretched as if she is holding onto a flowing white cloth that billows behind her. Her gaze is directed upwards and slightly to the left, suggesting a sense of aspiration or contemplation. She appears confident and dominant, with a nurturing yet authoritative presence, as she seems to be guiding or protecting the smaller figure below.",393,64
P004472,secular,2,Male,,"The male figure is also in flight, positioned beneath the female figure. He is holding a book and appears to be reading or studying it intently. His gaze is directed downwards towards the book, indicating focus and concentration. He appears passive and subordinate compared to the female figure, as he is being carried along by her and is engaged in an activity that is secondary to the main action of the scene.",412,72
P000768,secular,1,Female,,"The woman is standing upright, holding a basket, and appears to be serving food. Her posture is confident and she looks directly at the viewer with a warm, inviting expression. She seems dominant and nurturing.",210,35
P000768,secular,2,Male,,"The man is seated on the ground, leaning back slightly, and appears relaxed. He is looking towards the woman with a content expression. His posture suggests he is passive and submissive.",186,31
